{
  "schema": "codex-usage-tracker.question-catalog.v1",
  "version": 1,
  "source": "docs/product/SUPPORTED_QUESTION_CONTRACTS.md",
  "guidance_budget_bytes": 16384,
  "parameter_ids": [
    "allowance_selector",
    "cohort",
    "context_epoch",
    "current_project",
    "current_session",
    "current_window",
    "cursor",
    "driver_dimension",
    "end_observation",
    "entity_kind",
    "evidence_view",
    "family_mode",
    "left_session",
    "limit",
    "minimum_samples",
    "percentile",
    "previous_window",
    "project_selector",
    "rate_card",
    "resource_selector",
    "right_session",
    "scope",
    "session_selector",
    "start_observation",
    "threshold",
    "timezone",
    "tool_selector",
    "week_start",
    "window"
  ],
  "capabilities": [
    "allowance_observation",
    "completion_lifecycle",
    "compaction_boundary",
    "context_window",
    "model_call_usage",
    "project_identity",
    "publication_delta",
    "publication_state",
    "resource_identity",
    "session_hierarchy",
    "session_identity",
    "source_inventory",
    "source_occurrence",
    "state_change_observation",
    "structural_context",
    "tool_lifecycle",
    "turn_identity",
    "valuation"
  ],
  "measurements": [
    "allowance_limit",
    "allowance_percent",
    "cached_input_tokens",
    "call_count",
    "completion_state",
    "configured_cost_usd",
    "context_window_tokens",
    "duration_us",
    "estimated_credits",
    "event_time_us",
    "hierarchy_depth",
    "model_profile",
    "mutation_count",
    "output_tokens",
    "reasoning_tokens",
    "resource_operation",
    "source_occurrence_count",
    "tool_output_bytes",
    "tool_status",
    "turn_count",
    "uncached_input_tokens"
  ],
  "logical_primitives": [
    "allowance_observation",
    "canonical_call",
    "compaction_boundary",
    "context_component",
    "model_profile",
    "project",
    "publication",
    "publication_delta",
    "resource",
    "session",
    "source_manifestation",
    "source_occurrence",
    "state_change",
    "tool_invocation",
    "turn",
    "valuation_match"
  ],
  "coverage_dimensions": [
    "allowance",
    "capability",
    "comparison",
    "completion",
    "context",
    "freshness",
    "hierarchy",
    "history",
    "lifecycle",
    "measurement",
    "occurrence",
    "publication",
    "resource",
    "valuation",
    "window"
  ],
  "selector_kinds": [
    "allowance_interval",
    "allowance_observation",
    "call",
    "model_profile",
    "project",
    "publication",
    "rate_card",
    "resource",
    "session",
    "source_manifestation",
    "state_change",
    "tool",
    "turn",
    "window"
  ],
  "projection_ids": [
    "allowance_interval_current",
    "daily_usage_current",
    "latest_publication_delta_current",
    "model_effort_time_current",
    "root_family_usage_current",
    "session_usage_current",
    "tool_resource_current"
  ],
  "evidence_classes": [
    {
      "id": "E0",
      "selector_kinds": [
        "publication",
        "rate_card",
        "window"
      ]
    },
    {
      "id": "E1",
      "selector_kinds": [
        "call",
        "model_profile",
        "project",
        "resource",
        "session",
        "tool",
        "turn"
      ]
    },
    {
      "id": "E2",
      "selector_kinds": [
        "call",
        "model_profile",
        "resource",
        "session",
        "state_change",
        "tool",
        "turn"
      ]
    },
    {
      "id": "E3",
      "selector_kinds": [
        "model_profile",
        "project",
        "session",
        "tool",
        "window"
      ]
    },
    {
      "id": "E4",
      "selector_kinds": [
        "allowance_interval",
        "allowance_observation"
      ]
    },
    {
      "id": "E5",
      "selector_kinds": [
        "call",
        "resource",
        "session",
        "state_change",
        "tool",
        "turn"
      ]
    },
    {
      "id": "E6",
      "selector_kinds": [
        "source_manifestation"
      ]
    },
    {
      "id": "E7",
      "selector_kinds": [
        "call",
        "session",
        "turn"
      ]
    }
  ],
  "performance_classes": [
    {
      "id": "P0",
      "sql_p95_ms": 10,
      "mcp_p95_ms": 250,
      "query_calls": 1,
      "evidence_calls": 0,
      "response_bytes": 4096
    },
    {
      "id": "P1",
      "sql_p95_ms": 25,
      "mcp_p95_ms": 500,
      "query_calls": 1,
      "evidence_calls": 0,
      "response_bytes": 8192
    },
    {
      "id": "P2",
      "sql_p95_ms": 100,
      "mcp_p95_ms": 500,
      "query_calls": 1,
      "evidence_calls": 0,
      "response_bytes": 16384
    },
    {
      "id": "P3",
      "sql_p95_ms": 100,
      "mcp_p95_ms": 750,
      "query_calls": 1,
      "evidence_calls": 1,
      "response_bytes": 16384
    },
    {
      "id": "P4",
      "sql_p95_ms": 250,
      "mcp_p95_ms": 750,
      "query_calls": 1,
      "evidence_calls": 1,
      "response_bytes": 16384
    },
    {
      "id": "P5",
      "sql_p95_ms": 100,
      "mcp_p95_ms": 500,
      "query_calls": 1,
      "evidence_calls": 0,
      "response_bytes": 16384
    }
  ],
  "questions": [
    {
      "question_id": "Q-ACC-01",
      "version": 1,
      "title": "Current usage",
      "plan_id": "current_usage",
      "support_classes": ["N"],
      "stage": "Foundation",
      "intent_phrases": ["How much usage is in this session/today/this week/the selected window? Variants include token breakdown and current project"],
      "parameters": {
        "required": ["window"],
        "optional": ["current_project", "current_session", "scope", "timezone"]
      },
      "required_capabilities": ["model_call_usage", "session_identity"],
      "required_measurements": ["cached_input_tokens", "call_count", "output_tokens", "uncached_input_tokens"],
      "logical_plan": {
        "primitives": ["canonical_call", "project", "session", "valuation_match"],
        "operations": ["aggregate"],
        "compiler_id": null
      },
      "answers": {
        "fields": {
          "cached_input_tokens": "exact",
          "calls": "exact",
          "configured_cost_usd": "configured_estimate",
          "estimated_credits": "configured_estimate",
          "output_tokens": "exact",
          "reasoning_tokens": "exact",
          "total_tokens": "exact",
          "uncached_input_tokens": "exact"
        },
        "formulas": ["total_tokens_v1"],
        "kernel_conclusion_fields": []
      },
      "coverage_requirements": ["freshness", "history", "measurement", "publication", "valuation", "window"],
      "evidence": {
        "classes": ["E0"],
        "selector_kinds": ["publication", "window"]
      },
      "prohibited_claims": ["infer completion, productivity, or remaining allowance"],
      "order": ["window_start_asc"],
      "limits": {
        "default_rows": 10,
        "maximum_rows": 25,
        "exact_count_default": false
      },
      "performance_classes": ["P1"],
      "projection_consumers": ["daily_usage_current", "session_usage_current"],
      "oracle_ids": ["oracle:q-acc-01:boundaries", "oracle:q-acc-01:missing_measurement"],
      "lower_model_hint": "Report the four token classes and stated total formula; keep missing values null and do not infer outcomes."
    },
    {
      "question_id": "Q-ACC-02",
      "version": 1,
      "title": "Top sessions and concentration",
      "plan_id": "top_sessions",
      "support_classes": ["N"],
      "stage": "Foundation",
      "intent_phrases": ["List my top threads/sessions by usage and How concentrated is usage?"],
      "parameters": {
        "required": ["window"],
        "optional": ["limit", "project_selector", "timezone"]
      },
      "required_capabilities": ["model_call_usage", "session_identity"],
      "required_measurements": ["cached_input_tokens", "call_count", "output_tokens", "uncached_input_tokens"],
      "logical_plan": {
        "primitives": ["canonical_call", "session"],
        "operations": ["aggregate", "share"],
        "compiler_id": null
      },
      "answers": {
        "fields": {
          "cached_input_tokens": "exact",
          "calls": "exact",
          "output_tokens": "exact",
          "reasoning_tokens": "exact",
          "remainder_share": "deterministic",
          "top_share": "deterministic",
          "total_tokens": "exact",
          "uncached_input_tokens": "exact"
        },
        "formulas": ["hhi_v1", "top_n_share_v1", "total_tokens_v1"],
        "kernel_conclusion_fields": []
      },
      "coverage_requirements": ["history", "measurement", "publication", "window"],
      "evidence": {
        "classes": ["E0", "E1"],
        "selector_kinds": ["publication", "session", "window"]
      },
      "prohibited_claims": ["call a large session wasteful or semantically group sessions by label"],
      "order": ["total_tokens_desc", "session_id_asc"],
      "limits": {
        "default_rows": 10,
        "maximum_rows": 25,
        "exact_count_default": false
      },
      "performance_classes": ["P1"],
      "projection_consumers": ["session_usage_current"],
      "oracle_ids": ["oracle:q-acc-02:ties", "oracle:q-acc-02:duplicate_source"],
      "lower_model_hint": "Use returned labels and selectors, state concentration arithmetically, and never translate size into quality."
    },
    {
      "question_id": "Q-ACC-03",
      "version": 1,
      "title": "Period change and drivers",
      "plan_id": "period_drivers",
      "support_classes": ["N"],
      "stage": "Cutover",
      "intent_phrases": ["Compare the last seven days to the previous seven and explain which sessions/projects/models/tools account for the arithmetic change"],
      "parameters": {
        "required": ["current_window", "driver_dimension", "previous_window", "timezone"],
        "optional": ["limit", "week_start"]
      },
      "required_capabilities": ["model_call_usage", "session_identity"],